GEO_ID,NAME,VAL,TON,val_norm,ton_norm,vulnerability_score,rank,is_metro,INTPTLAT,INTPTLON,nearest_port,nearest_port_type,nearest_port_miles,nearest_seaport,nearest_seaport_miles,min_distance_to_neighbor_miles,num_commodities,max_comm_val,dominant_commodity,val_ton_ratio
E330000US0634800000,"Los Angeles-Long Beach, CA CFS Area; California",7963786,2600915,1.0,0.704773660294855,0.8819,1,1,34.3587477,-119.1331453,Port of Los Angeles,seaport,66.2,Port of Los Angeles,66.2,124.51,368,1227627,All Commodities,3.1005
E330000US4828800000,"Houston-The Woodlands, TX CFS Area; Texas",4234584,3688463,0.5309952109772115,1.0,0.7186,2,1,29.5266017,-95.7710149,Port of Houston,seaport,32.57,Port of Houston,32.57,113.46,296,614886,All Commodities,1.1545
E330000US1717600000,"Chicago-Naperville, IL-IN-WI CFS Area (part); Illinois",4290270,1826711,0.5379985861447467,0.494607844068737,0.5206,3,1,41.4013043,-89.5283772,Chicago Intermodal Hub,rail_intermodal,103.42,Port of Baltimore,697.2,101.12,326,603186,All Commodities,2.4271
E330000US4820600000,"Dallas-Fort Worth, TX-OK CFS Area (part); Texas",3757121,2004621,0.4709468591901031,0.5429033842167971,0.4997,4,1,33.5911611,-96.1049882,Dallas Intermodal Hub,rail_intermodal,69.05,Port of Beaumont,268.97,145.89,313,556846,All Commodities,1.9022
E330000US4899999999,"Remainder of Texas, Texas",2166305,2499898,0.27087715997454,0.6773515334940199,0.4335,5,0,30.8852677,-99.8588613,Dallas Intermodal Hub,rail_intermodal,222.21,Port of Corpus Christi,258.66,86.08,310,290108,All Commodities,0.8799
E330000US1799999999,"Remainder of Illinois, Illinois",1649079,2143013,0.205827996371415,0.5804713477498774,0.3557,6,0,40.401318,-91.1688008,St. Louis Intermodal Hub,rail_intermodal,133.04,Port of New Orleans,724.39,110.05,302,234968,All Commodities,0.772
E330000US4299999999,"Remainder of Pennsylvania, Pennsylvania",2254797,1619762,0.2820063966826091,0.4384293620379301,0.3446,7,0,41.513304,-79.249705,Port of Baltimore,seaport,209.59,Port of Baltimore,209.59,81.04,336,316920,All Commodities,1.404
E330000US0648800000,"San Jose-San Francisco-Oakland, CA CFS Area; California",2676802,1208140,0.3350800478260875,0.3266902421074891,0.3317,8,1,38.5251824,-122.9261095,Port of Oakland,seaport,61.4,Port of Oakland,61.4,85.7,324,404498,All Commodities,2.3665
E330000US1312200000,"Atlanta--Athens-Clarke County--Sandy Springs, GA-AL CFS Area (part); Georgia",2810434,932929,0.3518863372056098,0.2519813224307551,0.3119,9,1,33.0744405,-84.1466893,Atlanta Intermodal Hub,rail_intermodal,48.64,Port of Savannah,191.37,100.21,308,423851,All Commodities,3.0485
E330000US5599999999,"Remainder of Wisconsin, Wisconsin",1907979,1545598,0.2383886728587708,0.4182967644349807,0.3104,10,0,43.428001,-89.9433184,Chicago Intermodal Hub,rail_intermodal,159.01,Port of Baltimore,749.52,88.12,342,266696,All Commodities,1.2598
E330000US3440800000,"New York-Newark, NY-NJ-CT-PA CFS Area (part); New Jersey",2941650,810172,0.3683887772440991,0.2186576440430569,0.3085,11,1,41.1374609,-74.6919141,Port of New York/New Jersey,seaport,46.08,Port of New York/New Jersey,46.08,54.93,314,426311,All Commodities,3.7712
E330000US1899999999,"Remainder of Indiana, Indiana",1478665,1364914,0.184395801999394,0.3692481928194893,0.2583,12,0,38.940527,-84.9642994,Chicago Intermodal Hub,rail_intermodal,246.67,Port of Baltimore,450.06,13.84,307,226583,All Commodities,1.093
E330000US2199999999,"Remainder of Kentucky, Kentucky",1304216,1365364,0.1624561440135203,0.3693703500510481,0.2452,13,0,36.7272577,-85.1360977,Atlanta Intermodal Hub,rail_intermodal,210.06,Port of Savannah,396.13,49.16,294,229869,All Commodities,0.9676
E330000US5350000000,"Seattle-Tacoma, WA CFS Area; Washington",2123684,772235,0.2655169104860596,0.2083592465016205,0.2427,14,1,46.5800714,-122.3774443,Port of Tacoma,seaport,47.79,Port of Tacoma,47.79,30.12,311,283519,All Commodities,2.7674
E330000US2622000000,"Detroit-Warren-Ann Arbor, MI CFS Area; Michigan",2208645,712883,0.2762020693699616,0.1922475220405578,0.2426,15,1,42.2846636,-83.2619533,Chicago Intermodal Hub,rail_intermodal,225.72,Port of Baltimore,407.11,91.17,296,304767,All Commodities,3.2258
E330000US3640800000,"New York-Newark, NY-NJ-CT-PA CFS Area (part); New York",2123462,693455,0.2654889905548885,0.1869735871633923,0.2341,16,1,41.9472124,-74.2654582,Port of New York/New Jersey,seaport,88.03,Port of New York/New Jersey,88.03,60.14,286,338455,All Commodities,3.1226
E330000US2737800000,"Minneapolis-St. Paul, MN-WI CFS Area (part); Minnesota",1694483,950523,0.2115382511231798,0.2567573987241899,0.2296,17,1,45.9290434,-93.6329964,Chicago Intermodal Hub,rail_intermodal,409.24,Port of Baltimore,979.31,172.78,325,263931,All Commodities,1.8196
E330000US2514800000,"Boston-Worcester-Providence, MA-RI-NH-CT CFS Area (part); Massachusetts",1998837,723016,0.2498154706350866,0.1949982314347475,0.2279,18,1,42.3385513,-71.018253,Port of Boston,seaport,1.47,Port of Boston,1.47,72.07,313,331977,All Commodities,2.7747
E330000US4848400000,"San Antonio-New Braunfels-Pearsall, TX CFS Area; Texas",1051265,1292332,0.1306436462222761,0.3495450457505978,0.2182,19,1,29.756389,-99.2482849,Port of Corpus Christi,seaport,174.64,Port of Corpus Christi,174.64,86.08,256,182379,All Commodities,0.8158
E330000US5699999999,"Remainder of Wyoming, Wyoming",174295,1865677,0.0203511145146038,0.5051855744796713,0.2143,20,0,42.2299932,-110.6829614,Port of Portland,seaport,642.92,Port of Portland,642.92,50.53,202,27590,All Commodities,0.0935
E330000US2240600000,"New Orleans-Metairie-Hammond, LA-MS CFS Area (part); Louisiana",841834,1341376,0.1043044610642096,0.3628585552274201,0.2077,21,1,30.6213483,-90.4064899,Port of New Orleans,seaport,50.34,Port of New Orleans,50.34,40.73,263,136697,All Commodities,0.6319
E330000US2799999999,"Remainder of Minnesota, Minnesota",854337,1289970,0.1058769065571467,0.3489038560151714,0.2031,22,0,43.6791869,-92.0939369,Chicago Intermodal Hub,rail_intermodal,258.29,Port of Baltimore,857.64,109.08,285,150242,All Commodities,0.6686
E330000US2699999999,"Remainder of Michigan, Michigan",1100176,1033337,0.1367949604272705,0.279238129778214,0.1938,23,0,45.5355685,-87.5014573,Chicago Intermodal Hub,rail_intermodal,252.79,Port of Baltimore,704.93,182.74,281,164988,All Commodities,1.1105
E330000US5499999999,"Remainder of West Virginia, West Virginia",436544,1455814,0.0533329795131845,0.3939239535943679,0.1896,24,0,38.332606,-80.0101207,Port of Baltimore,seaport,195.68,Port of Baltimore,195.68,72.4,254,71171,All Commodities,0.3014
E330000US1299999999,"Remainder of Florida, Florida",867980,1040592,0.107592724669611,0.2812075758114565,0.177,25,0,30.0913354,-84.3591114,Port of Jacksonville,seaport,167.91,Port of Jacksonville,167.91,153.12,291,122833,All Commodities,0.8842
E330000US3799999999,"Remainder of North Carolina, North Carolina",1250149,737128,0.1556563831188047,0.1988290822164316,0.1729,26,0,34.6392096,-79.1008811,Port of Charleston,seaport,137.14,Port of Charleston,137.14,74.13,283,204808,All Commodities,1.7512
E330000US0199999999,"Remainder of Alabama, Alabama",1200745,744686,0.1494430665441375,0.2008807807855904,0.17,27,0,33.2703999,-85.8635254,Atlanta Intermodal Hub,rail_intermodal,91.21,Port of Savannah,290.07,63.41,292,194576,All Commodities,1.6686
E330000US3919800000,"Columbus-Marion-Zanesville, OH CFS Area; Ohio",1429094,573233,0.1781614825936207,0.154338061180142,0.1686,28,1,39.5552462,-83.4618927,Chicago Intermodal Hub,rail_intermodal,270.87,Port of Baltimore,367.96,43.07,284,218083,All Commodities,2.5056
E330000US3918400000,"Cleveland-Akron-Canton, OH CFS Area; Ohio",1230480,661308,0.153182702370138,0.1782469460013459,0.1632,29,1,41.7781416,-81.1973297,Port of Baltimore,seaport,298.35,Port of Baltimore,298.35,87.46,310,209544,All Commodities,1.9277
E330000US5199999999,"Remainder of Virginia, Virginia",858882,893992,0.1064485105534195,0.2414114643747436,0.1604,30,0,37.2853329,-80.0552407,Port of Norfolk/Virginia,seaport,207.17,Port of Norfolk/Virginia,207.17,72.4,302,136315,All Commodities,0.9764
E330000US1237000000,"Miami-Port St. Lucie-Fort Lauderdale, FL CFS Area; Florida",1238106,629854,0.1541417897355014,0.1697084269759,0.1604,31,1,26.1935353,-80.4766834,Port of Miami,seaport,34.69,Port of Miami,34.69,202.29,260,176538,All Commodities,2.0395
E330000US2099999999,"Remainder of Kansas, Kansas",751255,957526,0.0929127518500412,0.2586584367077594,0.1592,32,0,37.8793472,-96.2417321,Kansas City Intermodal Hub,rail_intermodal,123.28,Port of Beaumont,552.26,55.22,247,120277,All Commodities,0.7958
E330000US0599999999,"Remainder of Arkansas, Arkansas",998494,742597,0.1240068773581809,0.200313699770643,0.1545,33,0,35.8570011,-92.1404819,Memphis Intermodal Hub,rail_intermodal,127.39,Port of Beaumont,415.24,134.57,299,166275,All Commodities,1.3607
E330000US1399999999,"Remainder of Georgia, Georgia",877230,823329,0.1087560551350727,0.2222292500333217,0.1541,34,0,33.4806126,-82.4795333,Atlanta Intermodal Hub,rail_intermodal,111.37,Port of Savannah,126.86,50.83,281,132883,All Commodities,1.0928
E330000US2999999999,"Remainder of Missouri, Missouri",805837,871823,0.0997772819544555,0.2353934562271277,0.154,35,0,38.3864909,-93.7926278,Kansas City Intermodal Hub,rail_intermodal,64.98,Port of Beaumont,574.14,24.55,286,127483,All Commodities,0.9646
E330000US2899999999,"Remainder of Mississippi, Mississippi",1021139,711886,0.1268548361030869,0.1919768759075264,0.1529,36,0,32.0167482,-89.1191761,Port of New Orleans,seaport,152.98,Port of New Orleans,152.98,106.94,294,153310,All Commodities,1.4708
E330000US2299912940,"Baton Rouge, LA CFS Area; Louisiana",619526,982595,0.0763457941327648,0.2654636803476431,0.152,37,1,30.8397837,-91.0434338,Port of New Orleans,seaport,84.51,Port of New Orleans,84.51,40.73,237,113417,All Commodities,0.632
E330000US3199999999,"Remainder of Nebraska, Nebraska",628362,928305,0.0774570576995561,0.2507260890113598,0.1468,38,0,41.9158651,-96.7885168,Kansas City Intermodal Hub,rail_intermodal,226.56,Port of Beaumont,831.04,77.19,264,99873,All Commodities,0.6934
E330000US1999999999,"Remainder of Iowa, Iowa",779687,823106,0.0964885152872313,0.2221687143385715,0.1468,39,0,40.7363787,-93.7845799,Kansas City Intermodal Hub,rail_intermodal,120.66,Port of Beaumont,736.44,42.78,220,211233,All Commodities,0.9564
E330000US0699999999,"Remainder of California, California",957503,688475,0.1188516255625331,0.1856217138008082,0.1456,40,0,39.5769252,-120.5219926,Port of Oakland,seaport,155.39,Port of Oakland,155.39,89.5,289,148330,All Commodities,1.4091
E330000US1829400000,"Indianapolis-Carmel-Muncie, IN CFS Area; Indiana",1102121,584607,0.1370395742386568,0.1574256530729194,0.1452,41,1,40.0535128,-86.021709,Chicago Intermodal Hub,rail_intermodal,151.43,Port of Baltimore,505.06,88.07,274,175471,All Commodities,1.8984
E330000US4243000000,"Pittsburgh-New Castle-Weirton, PA-OH-WV CFS Area (part); Pennsylvania",979372,655077,0.1216019903137961,0.1765554755350283,0.1436,42,1,40.6841401,-80.3507209,Port of Baltimore,seaport,222.56,Port of Baltimore,222.56,81.04,255,167194,All Commodities,1.5703
E330000US2947600000,"St. Louis-St. Charles-Farmington, MO-IL CFS Area (part); Missouri",802205,758729,0.0993205018192601,0.2046929007917688,0.1415,43,1,38.4130031,-91.072832,St. Louis Intermodal Hub,rail_intermodal,49.48,Port of New Orleans,587.17,94.14,293,126748,All Commodities,1.0666
E330000US4242800000,"Philadelphia-Reading-Camden, PA-NJ-DE-MD CFS Area (part); Pennsylvania",1106517,500150,0.1375924391820265,0.1344989123934483,0.1364,44,1,40.0093755,-75.1333459,Port of Philadelphia,seaport,5.87,Port of Philadelphia,5.87,16.96,287,164263,All Commodities,2.2298
E330000US0442900000,"Phoenix-Mesa, AZ CFS Area; Arizona",1291187,340474,0.1608175458908715,0.0911531832681511,0.133,45,1,32.9185207,-111.3663394,Port of Long Beach,seaport,399.21,Port of Long Beach,399.21,59.78,303,214650,All Commodities,3.8194
E330000US4799999999,"Remainder of Tennessee, Tennessee",907962,600798,0.1126210791204316,0.1618208702644052,0.1323,46,0,35.163472,-85.2018432,Atlanta Intermodal Hub,rail_intermodal,108.17,Port of Savannah,319.11,74.42,288,134455,All Commodities,1.5726
E330000US4144000000,"Portland-Vancouver-Salem, OR-WA CFS Area (part); Oregon",1121691,414099,0.1395008042072066,0.1111394636537445,0.1282,47,1,45.1604934,-122.1951274,Port of Portland,seaport,38.48,Port of Portland,38.48,75.31,287,221225,All Commodities,2.723
E330000US3899999999,"Remainder of North Dakota, North Dakota",350729,948239,0.0425404169300928,0.2561373829089003,0.128,48,0,48.3769789,-97.7222304,Kansas City Intermodal Hub,rail_intermodal,659.77,Port of Seattle,1134.68,255.91,271,61206,All Commodities,0.3828
E330000US4899912420,"Austin-Round Rock-Georgetown, TX CFS Area; Texas",670563,697895,0.0827644856966318,0.1881788718481059,0.1249,49,1,29.8323986,-97.628141,Port of Corpus Christi,seaport,140.14,Port of Corpus Christi,140.14,97.29,226,105780,All Commodities,1.1018
E330000US4948200000,"Salt Lake City-Provo-Orem, UT CFS Area; Utah",946823,504209,0.1175084504953838,0.1356007706221087,0.1247,50,1,41.0375594,-112.2019434,Port of Oakland,seaport,582.31,Port of Oakland,582.31,64.43,286,209881,All Commodities,1.978
E330000US0821600000,"Denver-Aurora, CO CFS Area; Colorado",1026516,435459,0.1275310769585234,0.1169378602450691,0.1233,51,1,39.1189141,-105.7176479,Kansas City Intermodal Hub,rail_intermodal,596.82,Port of Long Beach,786.14,80.15,283,169382,All Commodities,2.4233
E330000US4899913140,"Beaumont-Port Arthur, TX CFS Area; Texas",425896,813435,0.0519938289406184,0.2195434197021155,0.119,52,1,30.1223229,-93.8940999,Port of Beaumont,seaport,13.94,Port of Beaumont,13.94,32.87,191,63114,All Commodities,0.7018
E330000US3699999999,"Remainder of New York, New York",892946,487948,0.1107325850372561,0.1311865511946027,0.1189,53,0,42.2667252,-77.3855253,Port of Philadelphia,seaport,199.65,Port of Philadelphia,199.65,40.95,263,129897,All Commodities,1.8742
E330000US1242200000,"Orlando-Lakeland-Deltona, FL CFS Area; Florida",914684,452054,0.113466474513819,0.1214427474844432,0.1167,54,1,29.057769,-81.161792,Port of Jacksonville,seaport,95.62,Port of Jacksonville,95.62,59.29,270,184905,All Commodities,2.148
E330000US3442800000,"Philadelphia-Reading-Camden, PA-NJ-DE-MD CFS Area (part); New Jersey",796192,480712,0.0985642741339822,0.1292222629111371,0.1108,55,1,39.8024071,-74.9612493,Port of Philadelphia,seaport,12.67,Port of Philadelphia,12.67,16.96,259,167898,All Commodities,1.7505
E330000US4740000000,"Nashville-Davidson--Murfreesboro, TN CFS Area; Tennessee",726454,504211,0.0897936427825908,0.1356013135431379,0.1081,56,1,35.8433688,-86.4172127,Atlanta Intermodal Hub,rail_intermodal,184.91,Port of Savannah,401.68,82.95,240,133085,All Commodities,1.4568
E330000US4099999999,"Remainder of Oklahoma, Oklahoma",398232,719744,0.0485146533734256,0.1941100126310577,0.1068,57,0,35.8980428,-94.6510258,Kansas City Intermodal Hub,rail_intermodal,221.25,Port of Beaumont,403.06,45.43,261,63685,All Commodities,0.5588
E330000US5537600000,"Milwaukee-Racine-Waukesha, WI CFS Area; Wisconsin",818487,401108,0.1013682149693843,0.1076129201088991,0.1039,58,1,42.6681095,-88.5417306,Chicago Intermodal Hub,rail_intermodal,71.78,Port of Baltimore,666.31,88.12,283,128832,All Commodities,2.24
E330000US4599999999,"Remainder of South Carolina, South Carolina",696579,463513,0.0860363997927888,0.1245534135209596,0.1014,59,0,34.6893424,-81.1612488,Port of Charleston,seaport,149.26,Port of Charleston,149.26,55.34,269,108587,All Commodities,1.5385
E330000US5399999999,"Remainder of Washington, Washington",536283,502959,0.0658767003017993,0.1352614449788898,0.0936,60,0,46.2946377,-123.4244583,Port of Portland,seaport,60.52,Port of Portland,60.52,36.28,277,75923,All Commodities,1.0761
E330000US1817600000,"Chicago-Naperville, IL-IN-WI CFS Area (part); Indiana",354346,609632,0.0429953105834523,0.1642189524501618,0.0915,61,1,41.0176883,-87.1188137,Chicago Intermodal Hub,rail_intermodal,65.07,Port of Baltimore,569.42,88.07,235,48909,All Commodities,0.6823
E330000US3726800000,"Greensboro--Winston-Salem--High Point, NC CFS Area; North Carolina",866810,245436,0.107445579086412,0.0653541188839606,0.0906,62,1,36.0439535,-79.4005733,Port of Norfolk/Virginia,seaport,182.06,Port of Norfolk/Virginia,182.06,24.86,254,125862,All Commodities,3.5726
E330000US0647200000,"Sacramento-Roseville, CA CFS Area; California",747056,326943,0.0923846627014495,0.0874800510454351,0.0904,63,1,38.4501363,-121.3443291,Port of Oakland,seaport,68.09,Port of Oakland,68.09,85.7,272,108942,All Commodities,2.4242
E330000US4820400000,"Corpus Christi-Kingsville-Alice, TX CFS Area; Texas",363627,586281,0.0441625397780415,0.1578800779743182,0.0896,64,1,28.1226209,-96.9675012,Port of Corpus Christi,seaport,34.09,Port of Corpus Christi,34.09,121.06,181,76679,All Commodities,0.6674
E330000US3745000000,"Raleigh-Durham-Cary, NC CFS Area; North Carolina",596094,406947,0.0733988579742027,0.1091979780535032,0.0877,65,1,35.7049939,-79.2514542,Port of Norfolk/Virginia,seaport,184.27,Port of Norfolk/Virginia,184.27,24.86,235,90050,All Commodities,1.4865
E330000US2454812580,"Baltimore-Columbia-Towson, MD CFS Area; Maryland",760818,291583,0.0941154469031451,0.0778812072500588,0.0876,66,1,39.3000324,-76.6104761,Port of Baltimore,seaport,3.07,Port of Baltimore,3.07,34.95,279,114945,All Commodities,2.6365
E330000US0114200000,"Birmingham-Hoover-Talladega, AL CFS Area; Alabama",517674,439882,0.0635363309362018,0.1181385301010349,0.0854,67,1,33.9773575,-86.56644,Atlanta Intermodal Hub,rail_intermodal,125.97,Port of Savannah,343.82,63.41,242,81316,All Commodities,1.1812
E330000US0699941740,"San Diego-Chula Vista-Carlsbad, CA CFS Area; California",786822,247921,0.0973858518138334,0.0660286982626798,0.0848,68,1,33.0236041,-116.7761174,Port of Long Beach,seaport,96.95,Port of Long Beach,96.95,163.91,234,147623,All Commodities,3.1925
E330000US3717200000,"Charlotte-Concord, NC-SC CFS Area (part); North Carolina",729927,286585,0.0902304262103258,0.0765244475982123,0.0847,69,1,35.4884909,-81.2268928,Port of Charleston,seaport,200.93,Port of Charleston,200.93,55.34,265,109987,All Commodities,2.5989
E330000US4736800000,"Memphis-Forrest City, TN-MS-AR CFS Area (part); Tennessee",862504,193737,0.1069040330340576,0.0513198817409414,0.0847,70,1,35.1845529,-89.8946125,Memphis Intermodal Hub,rail_intermodal,9.05,Port of New Orleans,361.41,134.57,251,134247,All Commodities,4.6116
E330000US1299945300,"Tampa-St. Petersburg-Clearwater, FL CFS Area; Florida",659780,324119,0.0814083567875427,0.086713446552275,0.0835,71,1,28.5559951,-82.5259685,Port of Tampa,seaport,42.91,Port of Tampa,42.91,89.57,288,109047,All Commodities,2.0702
E330000US1825800000,"Fort Wayne-Huntington-Auburn, IN CFS Area; Indiana",595891,364797,0.0733733275866904,0.0977559173641618,0.0831,72,1,41.643467,-85.0024051,Chicago Intermodal Hub,rail_intermodal,136.37,Port of Baltimore,472.21,76.15,258,102582,All Commodities,1.6855
E330000US3917800000,"Cincinnati-Wilmington-Maysville, OH-KY-IN CFS Area (part); Ohio",626665,337279,0.0772436337211898,0.0902858669240836,0.0825,73,1,39.4397469,-84.5657341,Chicago Intermodal Hub,rail_intermodal,232.73,Port of Baltimore,426.81,40.56,272,93099,All Commodities,1.9181
E330000US4699999999,"Remainder of South Dakota, South Dakota",322912,534480,0.0390419992481741,0.1438181518588123,0.081,74,0,43.6674723,-96.7957261,Kansas City Intermodal Hub,rail_intermodal,335.85,Port of Beaumont,950.13,121.03,248,53220,All Commodities,0.6139
E330000US2626600000,"Grand Rapids-Kentwood-Muskegon, MI CFS Area; Michigan",731507,240157,0.0904291356303723,0.0639210788275186,0.0798,75,1,43.054969,-86.2193493,Chicago Intermodal Hub,rail_intermodal,108.53,Port of Baltimore,565.35,115.64,271,108668,All Commodities,3.1388
E330000US1699999999,"Remainder of Idaho, Idaho",461596,417823,0.056483655710022,0.1121503826100222,0.0788,76,0,43.7969649,-112.3185879,Port of Portland,seaport,526.81,Port of Portland,526.81,136.19,281,83174,All Commodities,1.1216
E330000US2232400000,"Lake Charles-Jennings, LA CFS Area; Louisiana",322904,510399,0.0390409931245283,0.1372811112073287,0.0783,77,1,30.2295588,-93.3580154,Port of Beaumont,seaport,46.81,Port of Beaumont,46.81,32.87,180,52894,All Commodities,0.641
E330000US2299999999,"Remainder of Louisiana, Louisiana",405464,439320,0.0494241891492331,0.1179859692918436,0.0768,78,0,32.8293486,-92.3756501,Memphis Intermodal Hub,rail_intermodal,208.47,Port of Beaumont,215.98,158.15,252,77204,All Commodities,0.9416
E330000US4527300000,"Greenville-Spartanburg-Anderson, SC CFS Area; South Carolina",741623,192786,0.0917013789804924,0.0510617227915804,0.0754,79,1,34.1557959,-82.1278759,Atlanta Intermodal Hub,rail_intermodal,132.55,Port of Savannah,156.39,50.83,250,118998,All Commodities,3.9301
E330000US3610400000,"Albany-Schenectady, NY CFS Area; New York",420541,401414,0.0513203549252079,0.107695987026359,0.0739,80,1,43.1061353,-73.8553872,Port of Boston,seaport,152.06,Port of Boston,152.06,80.4,244,77926,All Commodities,1.0572
E330000US3999999999,"Remainder of Ohio, Ohio",423439,378084,0.0516848232159006,0.1013628132213214,0.0716,81,0,40.7716274,-84.1061032,Chicago Intermodal Hub,rail_intermodal,198.16,Port of Baltimore,411.61,27.89,208,111908,All Commodities,1.1369
E330000US1230000000,"Jacksonville-St. Marys-Palatka, FL-GA CFS Area (part); Florida",560967,259288,0.0689810948109298,0.0691143899318552,0.069,82,1,29.8904875,-81.4000404,Port of Jacksonville,seaport,36.34,Port of Jacksonville,36.34,59.29,246,92548,All Commodities,2.183
E330000US0940800000,"New York-Newark, NY-NJ-CT-PA CFS Area (part); Connecticut",538785,274723,0.0661913654720248,0.0733043829743222,0.069,83,1,41.3497173,-72.9002037,Port of New York/New Jersey,seaport,75.34,Port of New York/New Jersey,75.34,20.39,243,104070,All Commodities,2.172
E330000US0899999999,"Remainder of Colorado, Colorado",365608,390101,0.0444116811458339,0.1046249542249707,0.0685,84,0,38.0316514,-106.2346662,Kansas City Intermodal Hub,rail_intermodal,633.57,Port of Long Beach,731.83,80.15,253,61198,All Commodities,0.9644
E330000US2135000000,"Louisville/Jefferson County-Elizabethtown-Bardstown, KY-IN CFS Area (part); Kentucky",478383,310836,0.0585948804152876,0.0831076365371736,0.0684,85,1,37.9699453,-85.7026354,St. Louis Intermodal Hub,rail_intermodal,248.0,Port of Charleston,483.34,70.75,283,87209,All Commodities,1.5975
E330000US3099999999,"Remainder of Montana, Montana",243125,468193,0.0290075508321963,0.1258238487291711,0.0677,86,0,46.5052807,-108.4397631,Port of Seattle,seaport,657.72,Port of Seattle,657.72,265.91,276,43325,All Commodities,0.5255
E330000US4053800000,"Tulsa-Muskogee-Bartlesville, OK CFS Area; Oklahoma",371567,361087,0.0451611174965027,0.0967487988550881,0.0658,87,1,35.6175506,-95.3839106,Dallas Intermodal Hub,rail_intermodal,212.24,Port of Beaumont,389.45,45.43,252,55637,All Commodities,1.0732
E330000US4199999999,"Remainder of Oregon, Oregon",297360,398341,0.0358284403234737,0.1068617888650697,0.0642,88,0,45.593753,-117.1855796,Port of Portland,seaport,269.68,Port of Portland,269.68,244.93,266,49615,All Commodities,0.75
E330000US3616000000,"Buffalo-Cheektowaga-Olean, NY CFS Area; New York",413090,309808,0.0503832765145965,0.0828285751281904,0.0634,89,1,42.752759,-78.7781922,Port of Baltimore,seaport,266.96,Port of Baltimore,266.96,75.1,256,71150,All Commodities,1.3573
E330000US2931200000,"Kansas City-Overland Park-Kansas City, MO-KS CFS Area (part); Missouri",453419,273988,0.0554552715785539,0.0731048594961095,0.0625,90,1,38.741528,-93.8118634,Kansas City Intermodal Hub,rail_intermodal,48.08,Port of Beaumont,598.63,24.55,262,111438,All Commodities,1.6829
E330000US1747600000,"St. Louis-St. Charles-Farmington, MO-IL CFS Area (part); Illinois",249455,411426,0.0298036461669393,0.1104138496982852,0.062,91,1,38.885924,-89.4365916,St. Louis Intermodal Hub,rail_intermodal,44.82,Port of New Orleans,618.04,94.14,254,46764,All Commodities,0.6169
E330000US2031200000,"Kansas City-Overland Park-Kansas City, MO-KS CFS Area (part); Kansas",464440,232913,0.0568413326661056,0.0619546188599364,0.0589,92,1,39.7885021,-95.1472253,Kansas City Intermodal Hub,rail_intermodal,56.44,Port of Beaumont,673.2,93.48,272,73513,All Commodities,2.0302
E330000US0927825540,"Hartford-East Hartford-Middletown, CT CFS Area; Connecticut",563855,160340,0.0693443054470653,0.042253914935676,0.0585,93,1,41.4330028,-72.5227802,Port of New York/New Jersey,seaport,94.69,Port of New York/New Jersey,94.69,20.39,250,96646,All Commodities,3.5362
E330000US3646400000,"Rochester-Batavia-Seneca Falls, NY CFS Area; New York",356513,264662,0.0432678443260097,0.0705732187371819,0.0542,94,1,42.8563575,-77.3034967,Port of New York/New Jersey,seaport,225.19,Port of New York/New Jersey,225.19,40.95,245,53496,All Commodities,1.3573
E330000US2399999999,"Remainder of Maine, Maine",327467,283563,0.0396148608990041,0.0757040939231663,0.0541,95,0,44.1676811,-70.2074347,Port of Boston,seaport,132.28,Port of Boston,132.28,82.89,274,52441,All Commodities,1.169
E330000US4731500000,"Knoxville-Morristown-Sevierville, TN CFS Area; Tennessee",346041,237394,0.0419508284736513,0.0631710334257475,0.0504,96,1,36.138697,-84.6392616,Atlanta Intermodal Hub,rail_intermodal,165.72,Port of Savannah,347.02,49.16,249,59513,All Commodities,1.5994
E330000US3953400000,"Toledo-Findlay-Tiffin, OH CFS Area; Ohio",278516,267060,0.0334585160757807,0.0712241810511331,0.0486,97,1,41.000217,-83.6659471,Chicago Intermodal Hub,rail_intermodal,214.06,Port of Baltimore,393.06,27.89,183,97424,All Commodities,1.2057
E330000US3142000000,"Omaha-Council Bluffs-Fremont, NE-IA CFS Area (part); Nebraska",265722,267379,0.0318494728352275,0.0713107769552825,0.0476,98,1,40.9098778,-96.1406086,Kansas City Intermodal Hub,rail_intermodal,149.92,Port of Beaumont,756.68,77.19,253,44849,All Commodities,1.0009
